jp,en,tag,context,keywords,verified
貴重品は自己管理してください,Keep valuables with you,Sign,盗難防止の注意喚起に。,"貴重品は自己管理してください, Keep valuables with you, 財布, カバン, 盗難, security, wallet, bag, きちょうひん",TRUE
土足厳禁,No outdoor shoes,Sign,和室やジムの入り口に。,"土足厳禁, No outdoor shoes, 脱ぐ, スリッパ, shoes, take off, remove, どそく, くつ",TRUE
写真撮影禁止,Photos prohibited,Sign,撮影禁止の場所に。,"写真撮影禁止, Photos prohibited, カメラ, 禁止, OK, photo, camera, flash, さつえい",TRUE
準備中,Currently preparing / Closed,Sign,開店前のドアに。,"準備中, Currently preparing / Closed, 休み, closed, preparing, break, じゅんびちゅう, しゅうりょう",TRUE
本日の営業は終了しました,Closed for today,Sign,売り切れや閉店の案内に。,"本日の営業は終了しました, Closed for today, 休み, closed, preparing, break, じゅんびちゅう, しゅうりょう",TRUE
足元にご注意ください,Watch your step,Sign,段差や濡れた床に。,"足元にご注意ください, Watch your step, 段差, 滑る, 階段, step, floor, wet, stairs, caution, あしもと",TRUE
こちらでお待ちください,Please wait here,Sign,列の並び場所に。,"こちらでお待ちください, Please wait here, 列, 並ぶ, wait, line, here, queue, ここに",TRUE
このボタンを押してください,Please press this button,Sign,券売機やドアの説明に。,"このボタンを押してください, Please press this button, 押す, press, push, touch",TRUE
故障中,Out of order,Sign,機械が壊れている時に。,"故障中, Out of order, 壊れた, 修理, broken, repair, out of order, こしょう",TRUE
清掃中,Cleaning in progress,Sign,トイレなどの清掃時に。,"清掃中, Cleaning in progress",TRUE
関係者以外立入禁止,Staff only / Authorized personnel only,Sign,バックヤードの入り口に。,"関係者以外立入禁止, Staff only / Authorized personnel only",TRUE
頭上注意,Mind your head,Sign,天井が低い場所に。,"頭上注意, Mind your head",TRUE
扉に手を触れないでください,Do not touch the door,Sign,自動ドアや電車のドアに。,"扉に手を触れないでください, Do not touch the door, さわらない, touch, do not",TRUE
静かにしてください,Please keep quiet,Sign,図書館や深夜の廊下に。,"静かにしてください, Please keep quiet, うるさい, quiet, silence, noise, しずかに",TRUE
ゴミ箱はこちらです,Trash can is here,Sign,ゴミ捨て場の案内に。,"ゴミ箱はこちらです, Trash can is here",TRUE
禁煙エリア,Non-smoking area,Sign,喫煙禁止の場所に。,"禁煙エリア, Non-smoking area, タバコ, smoke, fire, cigarette, きんえん",TRUE
火気厳禁,No open flames,Sign,危険物の近くに。,"火気厳禁, No open flames, タバコ, smoke, fire, cigarette, きんえん",TRUE
土足で上がってください,Please keep your shoes on,Sign,逆に脱がなくて良い場所で。,"土足で上がってください, Please keep your shoes on, 脱ぐ, スリッパ, shoes, take off, remove, どそく, くつ",TRUE
ペット入店不可,No pets allowed,Sign,飲食店の入り口に。,"ペット入店不可, No pets allowed",TRUE
盲導犬可,Service dogs welcome,Sign,補助犬の入店許可に。,"盲導犬可, Service dogs welcome",TRUE
非常階段,Emergency stairs,Sign,避難経路の案内に。,"非常階段, Emergency stairs",TRUE
消火器,Fire extinguisher,Sign,防災設備の表示に。,"消火器, Fire extinguisher, タバコ, smoke, fire, cigarette, きんえん",TRUE
撮影禁止,No photos or video,Sign,美術館や劇場で。,"撮影禁止, No photos or video, カメラ, 禁止, OK, photo, camera, flash, さつえい",TRUE
フラッシュ禁止,No flash photography,Sign,水族館などで。,"フラッシュ禁止, No flash photography",TRUE
録音禁止,No recording,Sign,ライブ会場などで。,"録音禁止, No recording",TRUE
飲食禁止,No food or drinks,Sign,ショールームや店舗で。,"飲食禁止, No food or drinks, フード, ドリンク, eat, drink, food, no",TRUE
通話禁止,No calling,Sign,静かな場所でのマナーに。,"通話禁止, No calling",TRUE
順番待ち,Waiting list,Sign,混雑時のシステム案内に。,"順番待ち, Waiting list, 列, 並ぶ, wait, line, here, queue, ここに",TRUE
割り込み禁止,Do not cut in line,Sign,行列での注意に。,"割り込み禁止, Do not cut in line",TRUE
飲み終わった容器はこちらへ,Please return empty bottles here,Sign,返却口の案内に。,"飲み終わった容器はこちらへ, Please return empty bottles here, フード, ドリンク, eat, drink, food, no",TRUE
トイレットペーパーを流さないで,Do not flush toilet paper,Sign,古い配管の場所での注意に。,"トイレットペーパーを流さないで, Do not flush toilet paper, 化粧室, restroom, toilet, W.C",TRUE
トイレットペーパー以外流さないで,Do not flush anything but toilet paper,Sign,一般的なトイレのマナーに。,"トイレットペーパー以外流さないで, Do not flush anything but toilet paper, 化粧室, restroom, toilet, W.C",TRUE
手を洗ってください,Please wash your hands,Sign,衛生管理の案内に。,"手を洗ってください, Please wash your hands",TRUE
消毒してください,Please sanitize your hands,Sign,入り口での消毒依頼に。,"消毒してください, Please sanitize your hands",TRUE
検温にご協力ください,Please check your temperature,Sign,体温測定の依頼に。,"検温にご協力ください, Please check your temperature",TRUE
マスク着用,Masks required,Sign,感染対策のルールに。,"マスク着用, Masks required",TRUE
距離を保ってください,Please keep your distance,Sign,ソーシャルディスタンスの案内に。,"距離を保ってください, Please keep your distance",TRUE
お出口はあちらです,The exit is over there,Sign,帰りの客への案内に。,"お出口はあちらです, The exit is over there, でぐち, 外, exit, way out",TRUE
入口はこちら,Entrance this way,Sign,入り口案内に。,"入口はこちら, Entrance this way",TRUE
営業時間: __:__ - __:__,Business hours: __:__ - __:__,Sign,営業時間の表示に。,"営業時間: __:__ - __:__, Business hours: __:__ - __:__",TRUE
ペット同伴はご遠慮ください,Please do not bring pets,Sign,ペット不可の場所に。,"ペット同伴はご遠慮ください, Please do not bring pets",TRUE
ベビーカーは折りたたんでください,Please fold strollers,Sign,狭い通路での注意に。,"ベビーカーは折りたたんでください, Please fold strollers",TRUE
車椅子優先席,Wheelchair priority seating,Sign,優先席の表示に。,"車椅子優先席, Wheelchair priority seating",TRUE
スタッフにお声掛けください,Please ask staff for assistance,Sign,案内を必要とする場合に。,"スタッフにお声掛けください, Please ask staff for assistance",TRUE
飲食は店内指定場所で,Please eat only in designated areas,Sign,指定エリアでの飲食を促す案内に。,"飲食は店内指定場所で, Please eat only in designated areas, フード, ドリンク, eat, drink, food, no",TRUE
自転車をここに止めないでください,No bicycle parking here,Sign,駐輪禁止エリアに。,"自転車をここに止めないでください, No bicycle parking here",TRUE
入場料あり,Admission fee,Sign,有料施設の入り口表示に。,"入場料あり, Admission fee",TRUE
喫煙所はこちら,Smoking area here,Sign,指定喫煙所の案内に。,"喫煙所はこちら, Smoking area here",TRUE
危険物持ち込み禁止,No dangerous items,Sign,持ち込み禁止物の注意に。,"危険物持ち込み禁止, No dangerous items",TRUE
エレベーター点検中,Elevator under maintenance,Sign,エレベーター停止時の案内に。,"エレベーター点検中, Elevator under maintenance",TRUE
点検日は掲示をご確認ください,Check posted schedule for maintenance dates,Sign,定期点検の案内に。,"点検日は掲示をご確認ください, Check posted schedule for maintenance dates",TRUE
床が濡れています,Floor is wet,Sign,清掃や雨天時の注意喚起に。,"床が濡れています, Floor is wet",TRUE
ここは写真撮影OK,Photography allowed,Sign,撮影可の場所に。,"ここは写真撮影OK, Photography allowed, カメラ, 禁止, OK, photo, camera, flash, さつえい",TRUE
靴を脱いでください,Please take off your shoes,Sign,和室などでの案内に。,"靴を脱いでください, Please take off your shoes, 脱ぐ, スリッパ, shoes, take off, remove, どそく, くつ",TRUE
手荷物はここへ,Place carry-on items here,Sign,荷物置き場の案内に。,"手荷物はここへ, Place carry-on items here",TRUE
営業時間変更のお知らせ,Notice of business hour changes,Sign,臨時営業時間の掲示に。,"営業時間変更のお知らせ, Notice of business hour changes",TRUE
整理券をお取りください,Please take a numbered ticket,Sign,行列管理の案内に。,"整理券をお取りください, Please take a numbered ticket, チケット, 番号, ticket, number, せいりけん",TRUE
こちらは出口専用です,Exit only,Sign,一方通行の出口に。,"こちらは出口専用です, Exit only, でぐち, 外, exit, way out",TRUE
三脚・一脚の使用禁止,No tripods or monopods,Sign,混雑する場所での撮影制限。,"三脚・一脚の使用禁止, No tripods or monopods",TRUE
整理券を配布しています,Numbered tickets are being distributed,Sign,入場制限や行列整理のために。,"整理券を配布しています, Numbered tickets are being distributed, チケット, 番号, ticket, number, せいりけん",TRUE
最後尾はこちらです,The end of the line is here,Sign,行列の案内に。,"最後尾はこちらです, The end of the line is here",TRUE
ドローン飛行禁止,No drones,Sign,公園や神社仏閣での注意。,"ドローン飛行禁止, No drones",TRUE
歩きスマホはやめましょう,Please don't use your phone while walking,Sign,安全啓蒙の案内に。,"歩きスマホはやめましょう, Please don't use your phone while walking",TRUE